{
  "id": "01MA7K7K8Z3W1B3C5D6E7F8G9J",
  "ts": "2026-01-04T09:33:40Z",
  "kind": "media.ingest.completed",
  "scope": {
    "tenant": "ubl",
    "entity": "cust_42",
    "room": "room-123",
    "container": null
  },
  "actor": "ingest-worker",
  "refs": [
    "01MA7K7K8Z3W1B3C5D6E7F8G9I"
  ],
  "data": {
    "object_id": "r2://media/ubl/cust_42/2026/01/clip_12345.webm",
    "bytes": 203120000,
    "duration_ms": 9800,
    "media": {
      "type": "video",
      "width": 1920,
      "height": 1080,
      "duration_s": 37.4,
      "codecs": "vp9,opus"
    },
    "thumbnails": {
      "generated": 4
    },
    "playlist": {
      "hls": true,
      "dash": false
    },
    "trace_id": "trace-abc-123"
  },
  "meta": {
    "v": 1
  },
  "sig": null
}